id,problem_name,problem_statement
py_reverse_dict,PCRS C3-PL Reverse dictionary,"Write a function that reverses a dictionary, by switchingthe keys to values, and the values to keys. Because the keysof a dictionary must be unique, you may assume that the valuesare also unique. For example:    reverseDictionary({1:2}) => {2:1})    reverseDictionary({1:2, 3:4}) => {2:1, 4:3})    reverseDictionary({1:2, 3:4, 7:7, 9:6}) => {2:1, 7:7, 4:3, 6:9})"
py_recursive_times_in_list,PCRS C3-PL Recursive counting,"Write a function that takes a list and an item x, andreturns the number of times that x occurrs in the list. Userecursion in your implementation. For example:    recCount([1,2,3], 2) => 1    recCount([], 16) => 0    recCount([4,3,2,1,4,5,6,3], 4) => 2"
py_bracket_validator,PCRS C3-PL Bracket validation,"Bracket ValidatorYou're working with an intern that keeps coming to you with JavaScript code that won't run because the braces, brackets, and parentheses are off. To save you both some time, you decide to write a braces/brackets/parentheses validator.Let's say:'(', '{', '[' are called ""openers.""')', '}', ']' are called ""closers.""Write an efficient function that tells us whether or not an input string's openers and closers are properly nested.Examples:""{ [ ] ( ) }"" should return True""{ [ ( ] ) }"" should return False""{ [ }"" should return FalseSimply making sure each opener has a corresponding closer is not enough — we must also confirm that they are correctly ordered.For example, ""{ [ ( ] ) }"" should return False, even though each opener can be matched to a closer.We can do this in O(n) time and space. One iteration is all we need!Bonus:In Ruby, sometimes expressions are surrounded by vertical bars, ""|like this|"". Extend your validator to validate vertical bars. Careful: there's no difference between the ""opener"" and ""closer"" in this case—they're the same character!"
py_find_n_letters,PCRS C3-PL  Find N Letters,"Complete the body for the following function. While this function could be completed with a for loop, for practice, we request that you use a while loop."
py_event_class,PCRS C3-PL  Event Class,"Complete each method of the class Day.  The Day class depends class Event, so we have included the Event class definition below."
py_total_slices,PCRS C3-PL  Total Slices,"Complete the function according to its docstring.  When you think you are done, click ""Submit"" to have your code tested.  If both tests pass, congrats!  If one or both fails, edit your code and resubmit."
py_list_insert,PCRS C3-PL  List Insert,Complete the following code.
py_reverse_lookup,PCRS C3-PL  Reverse Lookup,"You have been asked to write a function that supplies the ""reverse lookup"" name for the person associated with a phone number.  This means that given a phone number, you get the name of the person who is registered with that phone number.  Write this function using parallel lists.Complete the following functions:"
py_realestate_class,PCRS C3-PL  Realestate Class,"Below we have provided a class RealEstateSystem which contains a collection of homes for sale and a Home class which contains a price instance variable. Your task is to complete the extract_minimum_price function which will return the lowest price of all the homes in the RealEstateSystem. If there are no homes in the system, return -1."
py_ipod_class,PCRS C3-PL  Ipod Class,"We have started to write a class to manage an iPod's music library.  To model this, we have created start code for a class that uses a dictionary to store the music using the artists name as the key and a list of their songs as the value. Complete the following code where indicated."
py_rectangle_class,PCRS C3-PL  Rectangle Class,"DO NOT USE THE WORD input ANYWHERE! We provide class Rectangle and starter code for class RectangleCollection. Complete class RectangleCollection, which has one list instance variable, rectangles, that should initially refer to an empty list.  Write a method add_rectangle that takes a Rectangle as a parameter and appends it to the rectangles list.  Write a method get_same_area_rects that takes a number as a parameter and returns a list of all Rectangles from the rectangles list that have that area."
py_special_list_class,PCRS C3-PL  Special List Class,"SpecialList is a class that has two instance variables value_list and size.  value_list refers to a list, and size stores an integer representing the maximum number of items that can be stored in the list.Complete the following code."
py_can_pay_with_two_coins,PCRS C3-PL  Can Pay With Two Coins,Complete the examples in the docstring and then the function body.
py_add_underscores,PCRS C3-PL  Add Underscores,Add at least one example and complete the function body according to the docstring
py_class_day_calendar,PCRS C3-PL  Class Day Calendar,"Below there is code for classes Event and Day.Improve class Day's __init__ method.   Update Day's  __init__ method to add default parameter values, so that if the date isn’t speciﬁed by the caller, it is set to January 1, 2014.  Improve class Day's  schedule_event method.  Improve method schedule_event so that if we attempt to schedule an event that overlaps with an existing event, the event is not scheduled and the method returns False.  Iff the event is successfully scheduled, the method should return True  "
py_double,PCRS C3-PL  Double,Function double takes a number and returns twice its value. Complete the function definition by adding a return statement to it.
py_our_maximum,PCRS C3-PL  Our Maximum, Function our maximum takes two numbers and returns the larger of the two.  Complete the function definition.
py_max_of_min,PCRS C3-PL  Max Of Min,"Function max_of_min takes four numbers, num1, num2, value1, and value2, determines the minimum of num1 and num2 and the minimum of value1 and value2, and returns the maximum of those two minimums.Complete the function definition."
py_caculate_tax,PCRS C3-PL  Caculate Tax,"Following the Function Design Recipe, define function calculate_tax.Here is its Type Contract:( number,  number) → numberThe first parameter represents a bill and the second represents a tax rate (a rate between 0.0 and 1.0 inclusive). Return the amount of tax to be paid on this bill."
py_same_abs,PCRS C3-PL  Same Abs,Complete the following function according to its docstring description.
py_upper_lower,PCRS C3-PL  Upper Lower,Complete this function according to its docstring description.
py_overdue_fees,PCRS C3-PL  Overdue Fees,"A library charges overdue fees for a borrowed book using the following fee schedule:less than 4 days late: 1 dollar per day4 to 6 days late: 2 dollars per day (for all days, including the first 3 days)more than 6 days late: 3 dollars per day (for all days, including the first 6 days)Borrowers of books are in one of these age groups: CHILD, ADULT, or SENIOR. A CHILD gets charged only half of the fees and a SENIOR gets charged only one quarter of the fees. An ADULT pays the full fee.Complete the following function according to the description above and the docstring below."
py_different_types,PCRS C3-PL  Different Types,Complete the following function according to its docstring description.
py_every_second_line,PCRS C3-PL  Every Second Line,"Complete the following function according to its docstring description.  Notes: report is a file open for reading, not a string representing the name of a file.the method str.strip() may come in handy!"
py_get_words,PCRS C3-PL  Get Words,"We will represent the words in the original story (the training text) as a list of strings.  You'll need to read the words in the training text file and create that list.  This string method will help:>>> help(str.split)Help on method_descriptor:split(...)    S.split(sep=None, maxsplit=-1) -> list of strings    Return a list of the tokens in S, using sep as the    delimiter string.  If maxsplit is given, at most maxsplit    splits are done. If sep is not specified or is None, any    whitespace string is a separator and empty strings are    removed from the result.Read the last sentence of that description carefully.If a variable training_text represents a file open for reading, then training_text.read() returns a string containing the entire contents of the file.  You can use the str method split to make your list.Complete the function below according to its docstring description."
py_context_to_next_words,PCRS C3-PL  Context To Next Words,"Here is an example of a story list:['And', 'the', 'fan,', 'and', 'the', 'cup,', 'And', 'the', 'ship,', 'and', 'the', 'fish.']You have worked out that it makes sense to represent the context information as a dictionary where the keys are tuples of strings and the values are lists of strings.  Below, we have given you the first key; write the list of values for it.  Fill in the dictionary with all the 2-word contexts and their values.Reminder: Python is case sensitive, so 'And' and 'and' are not equal."
py_calendar_event3,PCRS C3-PL  Calendar Event3,Complete each method of class Event.
py_user_class1,PCRS C3-PL  User Class1,"The User class represents a user with a username, password, and account information.Complete the update_account method in the code below according to its docstring description. Call the login method in your solution."
py_user_day,PCRS C3-PL  User Day,Below there is code for classes Event and Day.Complete the schedule_multiple_events function below according to its docstring description. Call theschedule_event method as part of your solution.
py_adjacent_match,PCRS C3-PL  Adjacent Match,Complete the function adjacent_match according to its docstring.
py_duplicate_cut,PCRS C3-PL  Duplicate Cut,"Suppose that we have been given several candidate sequences of enzymes that we can apply to a strand to correct a mutation. We'd like to filter out sequences that are less efficient or effective. In particular, sequences that contain the same enzyme in adjacent positions are inefficient, since the enzyme will cut the same location twice.Complete the function duplicate_cut according to its docstring."
py_student_by_degree,PCRS C3-PL  Student By Degree,This exercise uses the student record format from assignment 1. Recall that each student record was a comma separated sequence where the last item in the sequence is the degree being applied to.Complete the function students_by_degree according to its docstring.
py_has_last_token,PCRS C3-PL  Has Last Token,In this problem you will write the function has_last_token which takes as its first parameter a list of strings that are each a comma-separated sequence. Complete the function according to its docstring.
py_context_not_unique_hashtags,PCRS C3-PL  Context Not Unique Hashtags,"In this problem, you will write a function contains_no_unique_hashtags that takes two lists as parameters. The first list, tweet_hashtags, contains lists. Each list represents the hashtags found in a single tweet. The second list, unique_hashtags, is a list of hashtags uniquely used by a specific candidate.contains_no_unique_hashtags should return a new list of the hashtag lists for those tweets (from the original list) that cannot be attributed to the candidate. A tweet cannot be attributed to the candidate if it uses none of the unique hashtags used by the candidate.Your function should not change the original lists passed as parameters. You should complete the docstring (for practice for the exam) although PCRS will not test it."
py_non_intersecting,PCRS C3-PL  Non Intersecting,"Write a function non_intersecting that takes two lists as parameters. The first list L1 has elements that are themselves lists of strings. The second L2, is a list of strings.non_intersecting should return a new list that contains the original lists inside L1 that do not contain any of the strings in L2. Your function should not change the original lists passed as parameters.You should complete the docstring (for practice for the exam) although PCRS will not test it."
py_eligible,PCRS C3-PL  Eligible,"You are analyzing the results of the admissions process and you have two parallel lists of information about each student. The first list indicates whether or not the student was eligible for admission under the special case rules (stored as a string, either ""SC"" or ""non-SC"" and the second list has their average final mark (stored as an int). The lists are in the same order. In other words, a particular student occurs at the same index in both lists.The group you want to analyze is the students admitted (average final mark at least 65) under the special case rules. The first step is to count how many students fit these criteria, to see if there are enough to run statistical tests.Write a function count_admitted_sc that returns the number of students admitted under the special case rules.  Your function should take the special case / non-special case list as the first parameter and the admissions status list as the second.Write your own docstring."
py_return_indices,PCRS C3-PL  Return Indices,Write a function fun that takes as parameters two parallel lists (which are guaranteed to be the same length.) The first is a list of strings and the second a list of ints.Return the number of indices at which the first list holds the string 'x' and the corresponding integer in the second list is at least 65.Write a docstring for your function (even though PCRS won't explicitly test your docstring.)
py_reorganize,PCRS C3-PL  Reorganize,"Complete the function reorganize below that returns a dictionary new_dict mapping string keys to lists of strings from the data provided by the parameter input_dictThe keys in result_dict are the strings from the values in orig_dict. For each key k in new_dict, the corresponding value, is the list of keys in orig_dict where k was found in its value list. Complete the function below including writing a description."
py_reorder_by_hashtag,PCRS C3-PL  Reorder By Hashtag,"This function describes a potential helper function for detect_authors. In this question, we have a dictionary that connects candidates to the lists of the hashtags they use. The task is to write a function that produces a dictionary where the keys are hashtags and the values are the lists of candidates who use those hashtags.Complete the function below including writing a description."
py_valid,PCRS C3-PL  Valid,Complete the function below according to its docstring.
py_valid_DNA,PCRS C3-PL  Valid Dna,"DNA sequences have traditionally been represented as strings of the symbols A, C, G, and T which represent the nucleobases found in natural DNA.  Scientists have recently uncovered the importance of chemical modifications to numerous nucleobases. While many of these were previously known, they have recently been shown to likely have impacts on the regulation of genes (specific sequences of nucleobases that encode for various functional units in cells, often the class of large bio-molecules called proteins). Many other modifications have only recently been discovered and found to be involved in essential cellular processes, some necessary for the development of various organisms.In order to analyze these modifications computationally, researchers at U of T have proposed and made use of an additional set of symbols, in effect, defining an expanded DNA alphabet. For example, cytosine (C) is often modified, by the addition of a methyl group (a CH3) at its fifth carbon, forming 5-methylcytosine. These researchers assign the symbol m to this nucleobase, adding a fifth symbol to the DNA alphabet. They have already defined other symbols and there may be more to come.In this problem you will write a function valid_DNA_sequence that takes a sequence and a DNA nucleobase alphabet, and determines if all the symbols in the sequence are from those in the provided alphabet.Complete the function below."
py_item_catalog_class,PCRS C3-PL  Item Catalog Class,"For this problem, Item and Catalog classes have been defined in the editing space.The Item class creates objects consisting of attributes (e.g. ""style"") and values (e.g. ""flat""). When a new Item object is created, an id attribute is automatically assigned. Here’s an example of interacting with the class in a console:>>> obj = Item()>>> obj.id102>>> obj.style = ""flat"">>> obj.style’flat’Note that Python allows attributes to be assigned values with an assignment statement. In addition to id and style, possible attributes for the Itemclass include calories, color, label, name, shape, status and texture.The Catalog class produces objects that contain a collection of items. Here’s an example of interacting with the Item and Catalog class:>>> listing = Catalog()>>> listing.add(obj)>>> listing.has_style(""flat"")True>>> listing.has_style(""twisted"")False>>> listing.size()1Write a method for the Catalog class called lookup. This method should take a string as an argument to find the first object that matchesits shape attribute. The method should then return the name of the matching Item object. For example, consider that listing is a Catalogobject that has an Item with shape of ’round’ and name of ’apple’:>>> listing.lookup('round')'apple'If there is no matching object, the method should return the Python keyword None. You may assume that every object in the Cataloghas both name and shape attributes.Using just the editing space below, write your definition of the lookup method so that it works as described above. "
py_someCode,PCRS C3-PL  Somecode,"Define and assign variable ""a"" and ""b"" such that someCode() returns True."
py_my_max,PCRS C3-PL  My Max,"Write a function my_max(num1, num2) that returns the larger number of num1 or num2. If both nums are the same, return num1."
py_compute_sum,PCRS C3-PL  Compute Sum,"Write a function called compute_sum that    takes two parameters and returns their sum.Example calls: compute_sum(2, 3) => 5 compute_sum(4, -11) => -7 compute_sum(42, 0) => 42"
py_unique_integer,PCRS C3-PL  Unique Integer,Write a function called unique_integer that    returns the unique number in a list.
py_compute_product,PCRS C3-PL  Compute Product,"Write a function called computeProduct that    takes two parameters and returns their product.Example calls: computeProduct(2, 3) => 6 computeProduct(4, -11) => -44 computeProduct(42, 0) => 0"
py_hello_world,PCRS C3-PL  Hello World,Write a function called hello_world that    returns a suitable greeting with the name.
py_hello_world_name,PCRS C3-PL  Hello World Name,"Write a function called hello_world that    returns a suitable greeting using the 'name' parameter. Example calls: hello_world('KITE') => ""KITE says hello world!"" hello_world('Python') => ""Python says hello world!"""
py_shift_char,PCRS C3-PL  Shift Char,"Write a function that takes a single character and an int key as parameters,and then shifts the character ahead by the given number of spots,wrapping around from z to a. For simplicity, assume all input charsare lower-case letters. For example:shiftChar('a', 4) => 'e'shiftChar('z', 1) => 'a'shiftChar('z', 26) => 'z'"
py_unshift_char,PCRS C3-PL  Unshift Char,"Write a function that takes a single character and an int key as parameters,and then shifts the character backwards by the given number of letters,wrapping around from a back around z. For simplicity, assume all input charsare lower-case letters. Note that this it is harder to shift backwards thanforwards. You may need to add extra multiple of 26 sothat you don't get back a negative value when subtractingoff the key.For example:unshiftChar('a', 4) => 'w'unshiftChar('z', 1) => 'y'unshiftChar('z', 26) => 'z'"
py_a_before_b,PCRS C3-PL  A Before B,"Check if all instances of string a appear before string b. Return True if all instances of A are before B.aBeforeB(""cats cats cats dogs dogs"", ""cats"", ""dogs"") -> TrueaBeforeB(""cats cats dogs cats dogs"", ""cats"", ""dogs"") -> FalseaBeforeB(""dogs cats cats cats dogs"", ""cats"", ""dogs"") -> FalseaBeforeB(""cats dogs"", ""cats"", ""dogs"") -> True"
py_less_than_ten,PCRS C3-PL  Less Than Ten,"Write a function called lessThan10 that takes one parameterand returns true if the parameter is strictly less than 10,and false otherwise. For example:lessThan10(9) => TruelessThan10(10) => FalselessThan10(11) => False"
py_positive_less_than_ten,PCRS C3-PL  Positive Less Than Ten,Write a method that takes an int as a parameter and returns true if the parameter is both positive (i.e. greater than 0) and also strictly less than 10. For example:positiveLessThan10(10) => FalsepositiveLessThan10(-5) => FalsepositiveLessThan10(5) => True
py_in_between,PCRS C3-PL  In Between,"Write a method called isBetween that takes three parameters and returns true if the first number is between the other two (inclusive), and false otherwise.isBetween(3, 3, 3) should return True  isBetween(4, 7, 9) should return False  isBetween(2, 1, 3) should return True  isBetween(2, 3, 1) should return True  "
py_sum_twenty,PCRS C3-PL  Sum Twenty,"The method has 3 parameters: a, b and c. Return true if any pair of parameters (ab, ac, or bc) sums to 20. For example:sum20(5, 25, -5) => Truesum20(3, 10, 7) => Falsesum20(4, 19, -7) => False"
py_exactly_one_positive,PCRS C3-PL  Exactly One Positive,"Write a function that takes three parameters and returns True if at least one parameter is positive. For example:exactlyOnePositive(1,0,0) -> TrueexactlyOnePositive(1,7,1) -> TrueexactlyOnePositive(-9,-5,0) -> False"
py_exactly_one_positive2,PCRS C3-PL  Exactly One Positive2,"Write a function that takes parameters and returns True if exactly one parameter is positive. For example:exactlyOnePositive(7,0,0) -> TrueexactlyOnePositive(8,4,3) -> FalseexactlyOnePositive(1,5,0) -> False"
py_is_prime,PCRS C3-PL  Is Prime,Return True for prime numbers or False for numbers that are not prime.isPrime(5)=> TrueisPrime(11)=> TrueisPrime(8)=> FalseisPrime(1949)=> TrueisPrime(15)=> FalseisPrime(51)=> False
py_max_in_group,PCRS C3-PL  Max In Group,"Return the largest number in the group. Don't cheat and use max function!    max(1,8,0)=>8    max(-1,-5,-6)=>-1    max(100, 60, 1000)=>1000    max(1, 1, 0)=>1"
py_countA,PCRS C3-PL  Counta,"Write a function that takes a string and returns the number of ""a""s.countA(""This is a string"") -> 1countA(""Oranges are not apples"") -> 3countA(""To be or not to be"") -> 0"
py_countX,PCRS C3-PL  Countx,"Count all instances of a given character in the string.countX(""x1x2x3x4"", 'x') -> 4countX(""finding all the instances of n"", 'n') -> 5countX(""There are none of that letter"", 'z') -> 0"
py_replace1,PCRS C3-PL  Replace1,"Replace the first character in the string with c.replace1(""a"") -> ""c""replace1(""a goes to c"") -> ""c goes to c""replace1(""bats are not cats"") -> ""cats are not cats""replace1("""") -> """""
py_replaceC,PCRS C3-PL  Replacec,"Replace all of the given characters with c.replaceC(""replace the x with a c"", ""x"") -> ""replace the c with a c""replaceC(""This is not aaa work"", ""a"") -> ""This is not ccc work""replaceC(""To b or not to b for I want to b the world"", ""c"") -> ""To c or not to c for I want to c the world"""
py_replaceX,PCRS C3-PL  Replacex,"Replace all instances of ch1 with ch2.replaceX(""abvdef"", ""v"",""c"")->""abcdef""replaceX(""xreaspbaxpoinb"", ""a"",""i"")->""xreispbixpoinb""replaceX(""Four score and seven years ago"", ""e"",""t"")->""Four scort and stvtn ytars ago"""
py_replace_between_index,PCRS C3-PL  Replace Between Index,"Write a function that takes four parameters (a string s1, two ints,i and j, and another string s2) and replaces all of the characters of s1 between i (inclusive) and j (exclusive)with s2. If j is equal to or longer than the length of s1, replace everything in s1 from i to the end of the string with s2.For example:replaceAtIndex('knox college', 4, 10, ' villa') => 'knox village'replaceAtIndex('knox college', 5, 100, 'rocks') => 'knox rocks'replaceAtIndex('monmouth college', 0, 100, '') => ''"
py_is_in,PCRS C3-PL  Is In,"Return True if s2 is in s1 and False if it is not.isIn(""cats and dogs"", ""t"") -> TrueisIn(""cats and dogs"", ""dog"") -> TrueisIn(""cats and dogs"", ""pet"") -> FalseisIn(""cats and dogs"", ""ts and"") -> True"
py_is_not_in,PCRS C3-PL  Is Not In,"Return true if the second string is not in the first string. ""Use not in"".isNotIn(""I is not in team"", ""i"") -> FalseisNotIn(""I is not in team"", ""g"") -> TrueisNotIn(""team"", ""i"") -> TrueisNotIn(""I is not in team"", ""teams"") -> True"
py_dna_pairs,PCRS C3-PL  Dna Pairs,"Write a function that takes a String that consists only of thecapital letters A, C, G, and T, and returns the number of timeseach letter occurs. You can return multiple values by puttingthem in parentheses, like this:return (1, 2, 8, 4)Be sure to return the counts in the order ACGT.For example:countBasePairs('GATTACA') => (3, 1, 1, 2)countBasePairs('') => (0, 0, 0, 0)countBasePairs('GGTCAGGCCCCT' => (1, 5, 4, 2)"
py_dna_base_pairs,PCRS C3-PL  Dna Base Pairs,"Write a function that takes a string as a parameter,and returns True if the string is a DNA string (i.e.only contains the capital letters A, C, G, T), and False otherwise. A DNA string must be at least1 character in length, so the empty string is nota DNA string. For example:isDNAString('GATTACA') => TrueisDNAString('GATTACA 2: The Return of Ethan Hawke') => FalseisDNAString('') => False"
py_count_genes,PCRS C3-PL  Count Genes,"Write a function that takes strings named seqand gene as parameters, and returns the numberof times that gene occurs in seq.For example:countGenes('GATTACA', 'ATT') => 1countGenes('ATCGGATCGGAAAATTACCG', 'ATCGG') => 2countGenes('ATCGGATCGGAAAATTACCG', 'TTTTTTT') => 0"
