id,problem_name,problem_statement
py_between_two_genes,PCRS C3-PL  Between Two Genes,"Write a function that takes three parameters:a sequence of DNA called seq, a genecalled g1, and a gene called g2.Return all of the strings that occur between anoccurrence of g1 and the nearest occurrence ofg2 that comes after it. If g1 occurs without g2,return the empty string. If there are extra occurrences of g2,use the first one. If there are extra occurrences of g1, usethe last one.For example:betweenGenes('ATAATCGTGGCCA', 'AAT', 'GCCA') => 'CGTG'betweenGenes('CGTGATCGCAATGGGGCAGTC', 'AT', 'CA') => 'CGGGGG'betweenGenes('ATAATCGTGGCCA', 'AAT', 'GCCA') => 'CGTG'"
py_sum_list,PCRS C3-PL  Sum List,"Write a function that returns the sum of all elements of the list.Do not use the sum() function.    sumIt([1, 2, 3, 4, 5, 6])=> 21    sumIt([1, 2, 3, 4, 5, 6])=> -21    sumIt([-1, 2, -3, 4, -5, 6])=> 3"
py_list_average,PCRS C3-PL  List Average,"Write a function that takes a list of ints and returns the average.Do not use the sum() function.    avgIt([5,5,5,5])=>5    avgIt([5,15,10,20,25])=>15    avgIt([3,6,0,9])=>4.5"
py_max_in_list,PCRS C3-PL  Max In List,"Write a program that takes a list and finds the maximum element.Do not use the max() function.    maxList([5,5,5,5])=>5    maxList([5,15,10,20,25])=>25    maxList([-3,-2,-1,-6,-9,-11])=>-1"
py_greater_than_ten,PCRS C3-PL  Greater Than Ten,"Write a function that takes a list of ints and returns the sumof the values that are greater than 10.Do not use the max() function.    sumOver10([5,6,7,8,9])=>0    sumOver10([19,11,0,10,8])=>30    sumOver10([-3,-2,-1,-6,-9,-11, 57])=>57"
py_sum_greater_than_n,PCRS C3-PL  Sum Greater Than N,"Write a function that takes a list of ints and an int nand returns the sum of the values that are greater than n.    sumOverN([5,6,7,8,9], 7)=>17    sumOverN([19,11,0,10,8], 11)=>19    sumOverN([-3,-2,-1,-6,-9,-11,57], -2)=>56"
py_return_max_index,PCRS C3-PL  Return Max Index,"Write a function that takes a list of ints and returns the index (index, not the value)of the maximum element. If the max value occursmultiple times, return the index of the first occurrence.Do not use the max() function. The max ofan empty list is undefined, so your function can crashif given an empty list.    maxIndex([5,5,5,5])=>0    maxIndex([5,15,10,20,25])=>4    maxIndex([-3,-2,-1,-6,-9,-11])=>2"
py_longest_string,PCRS C3-PL  Longest String,"Write a function that takes a list of stringsand returns the index of the longest string. If there aremultiple longest strings, return the index of the first. If the list is empty, your code may crash.    longestStringIndex(['dog', 'cat', 'a', 'ab'])=>0    longestStringIndex(['', 'a', 'ab', 'abc']) => 3    longestStringIndex(['knox', 'college', 'flunk', 'day'])=>1"
py_count_longer,PCRS C3-PL  Count Longer,"Write a function that takes a list of stringsand a string, and returns the number of strings in the list that are longer than the given string.    countLongerStrings(['dog', 'cat', 'a', 'ab'], 'z')=>3    countLongerStrings(['', 'a', 'ab', 'abc'], 'abcd') => 0    countLongerStrings(['knox', 'college', 'flunk', 'day'], 'april')=>1"
py_num_above_average,PCRS C3-PL  Num Above Average,"Write a program that takes two lists of ints as parameters,and returns the number of elements in the second listthat are greater than the average of the first list.Do not use the sum() function.    numAboveAverage([5,5,5,5], [3,4,5,6,7])=>2    numAboveAverage([5,15,10,20,25], [34, 12, 19, -1])=>2    numAboveAverage([5, 7], [])=>0"
py_count_number_seven,PCRS C3-PL  Count Number Seven,"Write a function that takes a list of ints as a parameterand returns the number of times that 7 occurs directly before9 in the list.For example:    count79([1,2,7,8,9]) => 0    count79([1,2,7,9,8,9,7,9]) => 2    count79([7,9,7,9,7,9,7]) => 3"
py_count_NM,PCRS C3-PL  Count Nm,"Write a function that takes a list of ints and two ints,N and M, and returns the number of timesNM occurs in order in the given list.For example:    countNM([1,2,3,4,5], 2, 1) => 0    countNM([1,2,3,4,5], 1, 2) => 1    countNM([1,2,1,2,1], 1, 2) => 2    countNM([-3, 8, 9, 12, 8, 12, 9], 12, 8) => 1"
py_count_NMMN,PCRS C3-PL  Count Nmmn,"Write a function that takes a list of ints and two ints,N and M, and returns the number of timesNM or MN occurs in order in the given list.For example:    countNMorMN([1,2,3,4,5], 2, 1) => 1    countNMorMN([1,2,3,4,5], 1, 2) => 1    countNMorMN([1,2,1,2,1], 1, 2) => 4    countNMorMN([-3, 8, 9, 12, 8, 12, 9], 12, 8) => 2"
py_count_nums,PCRS C3-PL  Count Nums,"Write a function that takes a list of ints as a parameterand returns a dictionary containing the counts ofthe number of times each value occurs (keys are the numberand the values are the counts)For example:    countNums([1,2,3,1,2,4]) => {1:2, 2:2, 3:1, 4:1}    countNums([1,2,3,1,1,2,1]) => {1:4, 2:2, 3:1}    countNums([78]) => {78:1}"
py_num_greater_at_index,PCRS C3-PL  Num Greater At Index,"Write a function that takes two lists of ints that are the same length,and returns the number of values in the second list thatare greater than the value at the same index in the first list.For example:    numGreaterAtIndex([1,2,3], [7, 8, 9]) => 3    numGreaterAtIndex([7, 8, 9], [1, 2, 3]) => 0    numGreaterAtIndex([7, 8, 9], [9, 0, 53]) => 2"
py_is_sorted,PCRS C3-PL  Is Sorted,"Write a function that takes a list of ints and returnsTrue if the list is sorted from lowest to highest, andfalse otherwise. Assume that an empty list is sorted.For example:    isSorted([1,2,3,4,99, 123, 2342]) => True    isSorted([1,2,3,4,999, 50, 2342]) => False    isSorted([]) => True"
py_postfix,PCRS C3-PL  Postfix,
py_closed_interval,PCRS C3-PL  Closed Interval,"Add a Closed IntervalWrite a function which takes as input a list myl of disjoint closed intervals with integer endpoints,sorted by increasing order of left endpoint, and an interval interval, and returns the union of intervalwith the intervals in A, expressed as a union of disjoint intervals. Example[(1, 2)], (3, 4)-> [(1, 2), (3, 4)][(3, 4)], (1, 2)-> [(1, 2), (3, 4)][(0, 2), (3, 6), (7, 7), (9, 12)], (1, 8) -> [(0, 8), (9, 12)]"
py_merge_sort,PCRS C3-PL  Merge Sort,"Merging sorted arraysGTG 14.1Given sorted arrays arr1 and arr2 of lengths n and m respectively, return an array out containing the union of the elements of both arrays, without any duplicates.Use brute force to quickly establish the passing of test casesUse binary search to search through arr1 (the bigger of the two) between inserting the element in arr2 into outExample[1, 1], [] -> [1][1], [2] -> [1, 2][1, 2], [2], -> [1, 2][3, 4], [1, 2] -> [1, 2, 3, 4][3, 4, 4], [1, 1, 2] -> [1, 2, 3, 4][1, 2, 3, 6, 7, 8], [4, 4] -> [1, 2, 3, 4, 6, 7, 8] "
py_recurse_converge,PCRS C3-PL  Recurse Converge,"self_convergeGoal: Given a number, return the number of iterations it takes to arrive at a derived number that converges on to itself, as per the following routine. Recursion is recommended. Initialize a counter to count the number of iterationsTake any four-digit number, using at least two different digits. (Leading zeros are allowed.)Arrange the digits in descending and then in ascending order to get two four-digit numbers, adding leading zeros if necessary.Subtract the smaller number from the bigger number. Let's call this a sequence_number.Check if the sequence_number (the remainder) from Step 3 equals the orginal number. If not, increment the iteration counter, and go back to step 2 and perform it on the sequence_number.If there is a match, then return the count of iterationsIf the sequence_number collapses to zero, then return -1 Converge valuesWhile 3-digit numbers converge to the same unique number k which is also 3 digits long, all 4-digit numbers also converge to the same unique value k1 which is 4 digits long. However, 5 digit numbers converge to any one of the following values: 53955, 59994, 61974, 62964, 63954, 71973, 74943, 75933, 82962, 83952.Example1234  ->   31. 4321 - 1234 =  3087 /   2. 8730 - 378  =  8352 /   3. 8532 - 2358 =  6174 /      7641 - 1467 =  6174 // same as previous414 -> 41. 441 - 144 =  297 /   2. 972 - 279 =  693 /   3. 963 - 369 =  594 /4. 954 - 459 =  495 /   954 - 459 =  495 // same as previous50000 -> 31. 50000 - 5      =  49995 /   2. 99954 - 45999  =  53955 /  # first 3. 95553 - 35559  =  59994 /   99954 - 45999  =  53955 /  # 2nd time"
py_alert_weekend,PCRS C3-PL  Alert Weekend,"Write a function that will alert the user about whether it is the weekend yet, based on the current day (provided as a string)."
py_positive_two_digits,PCRS C3-PL  Positive Two Digits,Write a function that determines whether the given positive number has exactly two digits.
py_two_params_true_one,PCRS C3-PL  Two Params True One,Write a function that returns true if only one of the two given parameters is true. (Note- the normal ‘or’ operator returns true when both are true.)
py_negative_if_zero,PCRS C3-PL  Negative If Zero,A number is only considered negative if it’s less than 0. Write a function that determines whether the given number is negative.
py_continent,PCRS C3-PL  Continent,"Write a function which, when given a continent name, returns whether that continent is connected to any other continents or not. (Hint- only two continents are entirely surrounded by ocean!)."
py_avocados,PCRS C3-PL  Avocados,"You just bought avocados at the grocery store! They won’t be ripe for another two days, but after those two days you’ll need to eat them within a week, before they go bad. Write a function that takes the number of days that have passed to determine whether or not you can eat avocados."
py_two_params_true,PCRS C3-PL  Two Params True,Write a function that returns true if exactly two of the three given parameters are true.
py_simple_int_comparison,PCRS C3-PL Simple int comparison,Write a function which determines whether the given input is over 9000!
py_is_char_half_alphabet,PCRS C3-PL Is char half alphabet,"In python you can compare strings like you compare numbers (using alphabetical order); for example, the string ‘abcd’ is less than the string ‘zyxw’. Write a function that determines whether the given string starts with a letter in the first half of the alphabet (before ’N’). (Hint: you can assume that the first letter will be uppercase)."
py_char_is_lowercase,PCRS C3-PL Is char lowercase,A letter is lowercase if it comes between ‘a’ and ‘z’. Write a function that determines whether the given letter is lowercase.
py_is_teenager_if, PCRS C3-PL Is teenager,A person is generally considered to be a teenager between the ages of 13 and 18. Write a function which determines whether the given age is both teenaged and not prime. (Hint: only 13 and 17 are primes in that range).
py_can_drink_if,PCRS C3-PL If can drink,"A person can only drink alcohol if they’re 21 or older and aren’t planning on driving. Write a function which, given these two variables, determines whether or not you can drink."
py_is_candyshop_open_if,PCRS C3-PL Is candyshop open,"The candy shop around the corner is open between 1pm and 7pm every day, except for Wednesdays, when it’s closed. Write a function to tell whether or not it’s open given the current time (expressed as the hour) and day of week."
py_if_within_five,PCRS C3-PL Within five,Write a function which determines whether a number is within five of another number.
py_loan,PCRS C3-PL  Loan,"Write a program that reads the total amount of the loan taken from the bank, the down payment, and the loan term (the number of YEARS the loan is taken for). The program calculates and displays the monthly payment - the amount user would need to pay every month to return the loan.E.g.:Input: loan: $1200, down payment: $200, term: 1 year (pay attention it is 12 months!)Output: The monthly payment is $83.33"
py_utilties,PCRS C3-PL  Utilties,
py_open_file_reading,File Open Reading,This shows an example of how to text a function that involves reading from a file.
py_ascii_isoceles,ASCII Isoceles Triangle,Complete the following function.
py_swap_list_with_dict,Swap list with dictionary,"Write a function that takes a list of strings named  items and a dictionary named  d with strings as both the keys and the values. Return a new list containing all of the strings from  items ,but if any string in items occurs as the key in dreplace it with the value. For example:    swapper(['ab','bc','dog'], {'ab':'xyz'}) => ['xyz', 'bc', 'dog']"
py_modify_name_list,Modify Name in lists,Complete the following function according to its docstring.Note: this function should return None.  Its job is to modify the list passed as its argument.
py_same_name_list,Same Name in Two lists,"Complete the following function according to its docstring. The arguments we use for testing will not be shown; instead, they will be described in English. If you fail any test cases, you will need to read the description and make your own test."
py_mismatch_list,Mismatch List,Complete the following function according to its docstring.
py_check_if_list,Check If Digit in List,Complete the examples in the docstring and then the function body.
py_first_even_number,First Even Number,"Complete the following function according to its docstring.  Use a for loop.  The lists we test will not all be shown; instead, some will be described in English.  If you fail any test cases, you will need to read the description and make your own test."
py_ticket_price,Ticket Price,Complete the following function according to its docstring description.
py_name_sort,Name Alphabetical Order,Complete the following function according to its docstring description.
py_value_between,Is Teenager,Complete the following function according to instruction
py_legal_age,Can Vote,Complete the following function according to instruction
py_reverse_dictionary,Reverse Mapping,"You have been asked to write a function that supplies the ""reverse lookup"" name for the person associated with a phone number.  This means that given a phone number, you get the name of the person who is registered with that phone number. For this problem, you have been asked to write a solution using a dictionary"
py_total_number_of_pizza,Number of Slices,"Complete the function according to its docstring.  When you think you are done, click ""Submit"" to have your code tested.  If both tests pass, congrats!  If one or both fails, edit your code and resubmit."
py_multiple_first_second,Find Multiples,"In the function below, steps 1-4 of the Function Design Recipe have been completed. Write the body of the function and then click Submit to test your function."
py_multiple_of_three,Multiples of Three,"In the function below, steps 1-4 of the Function Design Recipe have been completed. Write the body of the function and then click Submit to test your function."
py_count_non_digits,Count Non Digits,Complete the following function according to its docstring.
py_lower_letter_case,Lower Letter Case,Complete the following function according to its docstring.
py_swap_first_last,Swap First Last,
py_no_lowercase,No Lower Case,Complete the following function according to its docstring description. The letter y is not considered a vowel.
py_operator1,Operator,"First, click the green ""Submit"" button in the centre bottom of the window and follow the instructions on your handout."
py_high_low_temp,High Low Temp,Complete the following function according to its docstring.
py_word_correctly_spelled,Word Spelling,"Many Unix-like systems (including CDF) have a dictionary of correctly spelled words in a ﬁle. On CDF,here is the path to the ﬁle: /etc/dictionaries-common/words. See below some of those words (the ﬁlecontains both capitalized and lowercase words); complete the function below, where dictionaryrefers to a ﬁle that has been opened for reading:"
py_class_day,Class Day,"Complete each method of the class Day.  The Day class depends class Event, so we have included the Event class definition below."
py_shoe_company,Shoe Company,"As part of a study funded by a major shoe company, we crouched at the ﬁnish line of the Boston marathonand kept an ordered list of the shoes that we saw as they passed the ﬁnish line. Write a function that,given such a list, will return a dictionary mapping shoe companies to a list of the placements achieved byrunners wearing shoes made by those companies."
py_checkout,Checkout,The express checkout is for grocery orders with 8 or fewer items. Complete the examples in the docstringand then complete the function body.
py_fluffy,Fluffy,Add at least one example to the docstring and complete the function body.
py_upper_case,Upper Case,Add at least one example to the docstring and complete the function body
py_mononym,Mononymize Names,Complete the following function according to its docstring description.
py_table_of_foods,Table of Foods,"You are a cook in a busy restaurant.  You are writing a program to help you organize how much of each kind of food you need to cook.  Naturally, you decide to take a break from cooking and write a function to help.  You decide that your function will take a dictionary as a parameter where the keys are the tables in the restaurant and the values are lists of strings describing the food each table has ordered.  Your function returns a dictionary with the totals for how many of each food item you need to cook.For example, say you have 5 tables and 3 dishes:Tables: t1, t2, t3, t4 and t5Dishes: Vegetarian stew, Steak pie, PoutineInput:You will use the table names as the keys, and use a list of the foods ordered at each table as values.For example your dictionary may look like this:{'t1': ['Vegetarian stew', 'Poutine', 'Vegetarian stew'],  't3': ['Steak pie', 'Poutine', 'Vegetarian stew'],  't4': ['Steak pie', 'Steak pie']}Output:Your function must return a dictionary with the dish as the key, and the number of times that dish was ordered as the value.  Given the above input, your function would create and return a dictionary equivalent to the following:{'Vegetarian stew': 3, 'Poutine': 2, 'Steak pie': 3}Here we have started the code for you.  Complete it:"
py_bubble_up,Bubble Up,"Below is a bubble_up function that takes 3 parameters: the list, a start index, and an end index, and bubbles the items in that range.  We have started a function called bubble_down that takes the same 3 parameters but bubbles in the opposite direction.  Complete function bubble_down."
py_return_list_of_list_even,List of Lists with Even,"This problem has you write a nested loop to process a list of list of int, and accumulate a list of list of int.  The starter code provides an accumulator for the result and a loop over the lists, and you need to write the code that checks whether sublist contains only even ints.  You'll probably want a one-way flag: a Boolean variable that starts out as True and is set to False if you find an odd int in the sublist.  You'll need to check the value of this variable to figure out whether to append sublist to the even_lists accumulator."
py_new_rectangle,New rectangle,Complete method area in the following class.  All it needs is a return statement.
py_create_circle_radius,Circle Radius,Complete method __init__ in the following class.  (It's only missing an assignment to a radius instance variable.)
py_return_cookies,Return Cookies,"In the function below, steps 1-4 of the Function Design Recipe have been completed.  Write the body of the function and then click Submit to test your function."
py_smallest_factor_while,Smallest Factor (While),Write a function that takes a positive integer greater than 1 and returns its smallest factor greater than 1.Instructions:- A factor of a number n is any number that divides n evenly (no remainder).- You must return the smallest factor that is greater than 1.- You can assume the input will always be greater than 1.Use a while loop in your solution.Examples of input/output:smallest_factor(15) -> 3smallest_factor(24) -> 2smallest_factor(49) -> 7
py_greatest_absolute_difference,Greatest Absolute Differemce,Complete the examples in the docstring and then complete the function body.
py_lastname_firstname_phonenumber,To Listing,"Copy and paste the contents of your solution for format_name into the box below. Then, complete the following function according to its docstring description."
py_lastname_firstname,Format Name,Complete the following function according to its docstring description.
py_collatz,Count Collatz Steps,"In math, the Collatz conjecture states that starting from any number, you will eventually obtain 1 byrepeatedly following these two steps:If the number is even, divide by 2.If the number is odd, multiply by 3 and add 1.Complete this function to count Collatz steps for a particular number."
py_nth_character,nth Character,"Complete the body for the following function. While this function could be completed with a for loop, for practice, we request that you use a while loop."
py_scale_midterm_grades,Scale Midterm Grades,Complete the examples in the docstring and then complete the function body.
py_collect_underperformers,Collect Underperformers,Complete the examples in the docstring and then complete the function body.
py_assignment,Add,Write a statement that adds the variable x to 42 and stores the result in a variable named result.
py_odd_condition,Check Odd Condition,Provide the boolean expression that evaluates to True if and only if the variable count is odd
py_sum_odd,Sum Odd Numbers,Write the body of a loop that computes the sum of all of the integers at odd indices of the list L. The result should be stored in the variable sum.
py_right_triangle,Right Triangle,Complete the following function according to its docstring description.
py_stretch_string,Repeating Character,Complete the examples in the docstring and then complete the function body.
py_search_list2,Search List 2,"Complete the following function according to its docstring using a for loop.  String method startswith may come in handy here.  The lists we test will not all be shown; instead, some will be described in English. If you fail any test cases, you will need to read the description and make your own test."
py_even_insertion_sort,Even Insertion Sort,"The code for insertion sort is as follows:def insert(L, i):    """""" (list, int) -> NoneType    Precondition: L[:i] is sorted from smallest to largest.    Move L[i] to where it belongs in L[:i + 1].    >>> L = [7, 3, 5, 2]    >>> insert(L, 1)    >>> L    [3, 7, 5, 2]    """"""    # The value to be inserted into the sorted part of the list.    value = L[i]    # Find the index, j, where the value belongs.    # Make room for the value by shifting.    j = i    while j != 0 and L[j - 1] > value:        # Shift L[j - 1] one position to the right to L[j].        L[j] = L[j - 1]        j = j - 1    # Put the value where it belongs.    L[j] = value    def insertion_sort(L):    """""" (list) -> NoneType    Sort the items of L from smallest to largest.    >>> L = [7, 3, 5, 2]    >>> insertion_sort(L)    >>> L    [2, 3, 5, 7]    """"""    for i in range(len(L)):        insert(L, i)Rewrite the insert() function so that it only sorts the elements at the EVEN indices."
py_first_integer_less_than,First Integer Less Than,"Complete the following function according to its docstring using a while loop.  The lists we test will not all be shown; instead, some will be described in English. If you fail any test cases, you will need to read the description and make your own test."
py_find_index_in_list,Find Index List,Complete the following function.  Note that neither item_list nor index_list should be mutated.
py_sum_two_int,Sum of two integer numbers,"Given 2 integers, num1 and num2, calculate their sum and store it in variable called sum.E.g.: if the value of num1 is 3 and the value of num2 is 4, the program prints 7.Authors: Yana Kortsarts, Yulia Kempner, Leonid Kugel, Kamil Akhuseyinoglu"
py_next_day,Next Day,"Complete the following program that checks three integers, representing a date: month, day, and year. The month, day and year values are already set to variables month, day, and year respectively. You can assume that the values of these variables are always valid. For the program to work correctly, you only need to update the current values of month, day and year variables to the next day's date. E.g. 1: If the given three integers (month day year) are 3 30 2015 which represents the actual date March 30, 2015, the next day's date is 3 31 2015 (March 31, 2015) .  E.g. 2: If the given three integers (month day year) are 12 31 2016 which represents the actual date December 31, 2016, the next day's date is 1 1 2017 (January 1, 2017). Hint 1: Do not forget to consider the leap year. If the current year is a leap year and the current date given is 02 28 1988, the next day's date becomes 02 29 1988 instead of 03 01 1988In the Gregorian calendar, a year is a leap year when the number representing that year is divisible by 4, but not by 100, unless it is divisible by 400. Hint 2: Assume that there are no leap years before 1582.Authors: Yana Kortsarts, Yulia Kempner, Leonid Kugel, Kamil Akhuseyinoglu"
