id,problem_name,problem_statement
py_perishable_food,Perishable Food,"A grocery store sells perishable and nonperishable food.  Each item in the store has a bar code, a 9-digit positive integer. The bar code of perishable items ends with 3, 4, or 7. Write a program that checks one integer, the barcode of a single item, whether the item is perishable or not. The variable, perishable, is True if it is perishable, and false otherwise. If the given integer is not a 9-digit positive integer, then perishable should be False.Assume that the barcode value is already stored in a variable called barcode.E.g. 1: If the barcode is 342564643, perishable is True since the barcode finishes with 3.E.g. 2: If the barcode is 442554645, perishable is False since the barcode finishes with 5.E.g. 3: If the barcode is 325, perishable is False since the barcode is not a 9-digit integer.Authors: Yana Kortsarts, Yulia Kempner, Leonid Kugel, Kamil Akhuseyinoglu"
py_leap_year,Leap Year,"In the Gregorian calendar, a year is a leap year when the number representing that year is divisible by 4, but not by 100, unless it is divisible by 400. Thus years such as 1996, 1992, 1988 and so on are leap years because they are divisible by 4 but not by 100. For century years, the 400 rule is important. Thus, century years 1900, 1800 and 1700, while all still divisible by 4, are also divisible by 100. As they are not further divisible by 400, they ARE NOT leap years. On the other hand, the year 2000 is a leap year since it is divisible by 4 and 100 but also by 400. Also, you can assume that there were no leap years before 1582. Write a program that checks whether or not a given year is a leap year and returns True or False accordingly.Assume that the value of the year is already set to a variable year.E.g. 1: If the year is 1980, then leap_year is TrueE.g. 2: If the year is 1900, then leap_year is FalseE.g. 3: If the year is 1200, then leap_year is FalseE.g. 4: If the year is 2000, then leap_year is TrueE.g. 5: If the year is 3000, then leap_year is FalseAuthors: Yana Kortsarts, Yulia Kempner, Leonid Kugel, Kamil Akhuseyinoglu"
py_treasure_box,Treasure Box,"A treasure box with 1 million dollars inside has a lock combination that uses a 3-digit positive integer. To open the box, the following rules need to be satisfied: (1) The first digit equals the last digit.(2) The middle digit is odd.Write a program that checks single 3-digit integer and prints YES if the number opens the box and NO otherwise.Assume that the 3-digit integer is already set to variable code.E.g. 1: if code is 212, the program prints 'YES'E.g. 2: if code is 312, the program prints 'NO'E.g. 3: if code is 999, the program prints 'YES'Authors: Yana Kortsarts, Yulia Kempner, Leonid Kugel, Kamil Akhuseyinoglu"
py_max_three_int,Maximum of three integers,"Complete the following program that finds the maximum value among the three integer values.  Assume that the three integer values are already assigned to num1, num2, and num3 respectively. E.g.: If num1=5, num2=10, and num3=7, then the maximum is 10Authors: Yana Kortsarts, Yulia Kempner, Leonid Kugel, Kamil Akhuseyinoglu"
py_is_even,Is Even,"Write a program that checks whether the given integer is even or odd and sets a variable called  is_even to True if the given number is even or False otherwise.Assume that the integer number is already set to a variable num.Authors: Yana Kortsarts, Yulia Kempner, Leonid Kugel, Kamil Akhuseyinoglu"
py_diary_farm,Diary Farm,"A dairy farm ships milk bottles using containers of a specific size. Each container holds a certain number of milk bottles. Complete the following program that calculates and prints the number of containers fully packed with milk bottles and the number of remaining milk bottles. Assume that the size of a container and the number of milk bottles stored in container_size and bottle_count respectively. Store the number of fully packed containers and remaining milk bottles in variables container_count and remaining respectively. E.g. if the farm needs to ship 118 milk bottles and the capacity of one container is 24 bottles, then 4 containers will be fully packed and 22 bottles of milk will be leftover. In this case, the number of fully packed containers is 4 and 22 bottle(s) leftAuthors: Yana Kortsarts, Yulia Kempner, Leonid Kugel, Kamil Akhuseyinoglu"
py_accommodation_cost,Calculate accommodation cost,"Complete the following program that computes and prints the total cost of the hotel stay based on the number of nights, the price per night and the tax percent. Assume that the number of nights, the price per night and tax percent stored in variables nights, price, and tax respectively.Store the total cost in variable total as floating-pointE.g. if the person stayed 3 nights, with $99.99 per night and a 14.5% tax, the cost is 343.47Authors: Yana Kortsarts, Yulia Kempner, Leonid Kugel, Kamil Akhuseyinoglu"
py_unicode_value,Find ASCII/Unicode value,"Complete the following program that prints the ASCII/Unicode value of the given character that is stored in variable char. Assume that char is already set to a character. The ASCII/Unicode value should be stored in unicode_valueHint: Use ord() built-in function.E.g.: If char is 'a', the Unicode value of a is 97Authors: Yana Kortsarts, Yulia Kempner, Leonid Kugel, Kamil Akhuseyinoglu"
py_sum_digits_pcrs,Sum digits of a number,"Complete the following code which calculates the sum of the digits of a three-digit positive integer that is stored in variable num. The value of num is between 100 and 999.The sum of the digits should be stored in variable sum.E.g. 1: If num is 100, the value of sum should be 1E.g. 2: If num is 999, the value of sum should be 27Authors: Yana Kortsarts, Yulia Kempner, Leonid Kugel, Kamil Akhuseyinoglu"
py_quotient_remainder,Calculate quotient and remainder,"Given two integer numbers, num1 and num2, complete the following code that calculates the quotient (result of the division of the num1 by the num2), the integer quotient (integer division of the num1 by the num2), and the remainder (remainder from the division of the num1 by the num2).Assume that the initial values of num1 and num2 are already set.Quotient, integer quotient and remainder should be stored in quotient, integer_quotient, and remainder variables respectively.E.g. 1: If the value of num1 is 25 and num2 is 5, the quotient is 5.0, the integer quotient is 5, and the remainder is 0.0E.g. 2: If the value of num1 is 14 and num2 is 4, the quotient is 3.5, the integer quotient is 3, and the remainder is 2.0Authors: Yana Kortsarts, Yulia Kempner, Leonid Kugel, Kamil Akhuseyinoglu"
py_avg_two_int,Calculate average of two integer numbers,"Given two integer variables first_num, second_num, write a program that calculates their average.Assume that the initial values of first_num, second_num are set to an integer value. The average of the two numbers should be stored in the variable averageE.g.: If first_num is 3 and second_num is 5, then the average is 4.0If first_num is 4 and second_num is 5, then the average is 4.5Authors: Yana Kortsarts, Yulia Kempner, Leonid Kugel, Kamil Akhuseyinoglu"
py_monthly_bill,Calculate monthly bill,"Write a program that calculates the total monthly bill by using electric, water, and gas bills for that month. Electric, water, and gas bills are stored in variables electricity, water, and gas, respectively. Assume that the initial values of electricity, water, and gas are already set to a floating-point number. The total monthly bill is stored in a floating-point variable total. Eg.:If the electricity bill is 50.6, the water bill is 40.4 and the gas bill is 95.5, variable total should have the value of 186.5.Authors: Yana Kortsarts, Yulia Kempner, Leonid Kugel, Kamil Akhuseyinoglu"
py_sum_product,Calculate sum and product,"Given 2 integers, first_num and second_num, write a program to calculate their sum and product that are stored in variables sum and product respectively. Assume that the initial value of the variables first_num and second_num are already set to an integer.E.g.: if the value of first_num is 3 and the value of second_num is 4, the value of sum will be 7 and the product will be 12Authors: Yana Kortsarts, Yulia Kempner, Leonid Kugel, Kamil Akhuseyinoglu"
py_second_in_days,Calculating the Seconds in n Days,"Calculate the seconds in n days and set the value to the variable secondsE.g. 1: if the value of n is 1, seconds variable is set to 86400.E.g. 2: if the value of n is 2, seconds variable is set to 172800."
pcrs_sample_problem4,PCRS sample problem 4,Write the body of a loop that computes the sum of all of the integers at odd indices of the list L. The result should be stored in the variable sum.
pcrs_sample_problem3,PCRS sample problem 3,Provide the boolean expression that evaluates to True if and only if the variable count is odd
pcrs_sample_problem2,PCRS sample problem 2,Complete the function as described by its docstring.
pcrs_sample_problem1,PCRS sample problem 1,Write a statement that adds the variable x to 42 and stores the result in a variable named result.
